{
  "$schema": "../../../schemas/sprite.schema.json",
  "schemaVersion": 1,
  "id": "mayor-bramble",
  "name": "Mayor Bramble",
  "kind": "character",
  "status": "outline",
  "description": "Town mayor in a top hat and suit. Runs festivals and the community ledger.",
  "tags": ["villager", "human", "mayor"],
  "canvas": {
    "width": 16,
    "height": 32
  },
  "pivot": {
    "x": 8,
    "y": 32
  },
  "palette": {
    ".": {
      "name": "empty",
      "color": null
    },
    "#": {
      "name": "outline",
      "color": "#2b2118"
    }
  },
  "frames": {
    "idle-down": {
      "pixels": [
        "................",
        "................",
        "......####......",
        "......#..#......",
        "......####......",
        "...##########...",
        ".....######.....",
        ".....#....#.....",
        ".....#.##.#.....",
        ".....#....#.....",
        ".....#.##.#.....",
        ".....#....#.....",
        ".....######.....",
        "................",
        "....########....",
        ".####...#..#....",
        ".#.##...#..#....",
        ".#.##.####.#....",
        ".#.##...#..#....",
        ".#.##...#..#....",
        ".####...#..#....",
        "....########....",
        ".....######.....",
        ".....#.##.#.....",
        ".....#.##.#.....",
        ".....#.##.#.....",
        ".....#.##.#.....",
        ".....#.##.#.....",
        ".....######.....",
        "....########....",
        "................",
        "................"
      ]
    },
    "idle-right": {
      "pixels": [
        "................",
        "................",
        "........####....",
        "........#..#....",
        "........####....",
        "......#########.",
        ".......######...",
        ".......#....#...",
        ".......#...##...",
        ".......#....#...",
        ".......#....#...",
        ".......#....#...",
        ".......######...",
        "................",
        ".......######...",
        "...#####....#...",
        "...#.#.#....#...",
        "...#.#.#....#...",
        "...#.#.#....#...",
        "...#.#.#....#...",
        "...#####....#...",
        ".......######...",
        ".........##.....",
        ".........##.....",
        ".........##.....",
        ".........##.....",
        ".........##.....",
        ".........##.....",
        ".........##.....",
        "........####....",
        "................",
        "................"
      ]
    },
    "idle-left": {
      "pixels": [
        "................",
        "................",
        "....####........",
        "....#..#........",
        "....####........",
        ".#########......",
        "...######.......",
        "...#....#.......",
        "...##...#.......",
        "...#....#.......",
        "...#....#.......",
        "...#....#.......",
        "...######.......",
        "................",
        "...######.......",
        "...#....#####...",
        "...#....#.#.#...",
        "...#....#.#.#...",
        "...#....#.#.#...",
        "...#....#.#.#...",
        "...#....#####...",
        "...######.......",
        ".....##.........",
        ".....##.........",
        ".....##.........",
        ".....##.........",
        ".....##.........",
        ".....##.........",
        ".....##.........",
        "....####........",
        "................",
        "................"
      ]
    },
    "idle-up": {
      "pixels": [
        "................",
        "................",
        "......####......",
        "......#..#......",
        "......####......",
        "...##########...",
        ".....######.....",
        ".....#....#.....",
        ".....#....#.....",
        ".....#....#.....",
        ".....#....#.....",
        ".....######.....",
        "................",
        "................",
        "....########....",
        "..####..#..#....",
        "..#.##..#..#....",
        "..#.######.#....",
        "..#.##..#..#....",
        "..#.##..#..#....",
        "..####..#..#....",
        "....########....",
        ".....######.....",
        ".....#.##.#.....",
        ".....#.##.#.....",
        ".....#.##.#.....",
        ".....#.##.#.....",
        ".....#.##.#.....",
        ".....######.....",
        "....########....",
        "................",
        "................"
      ]
    },
    "walk-down-left": {
      "pixels": [
        "................",
        "................",
        "......####......",
        "......#..#......",
        "......####......",
        "...##########...",
        ".....######.....",
        ".....#....#.....",
        ".....#.##.#.....",
        ".....#....#.....",
        ".....#.##.#.....",
        ".....#....#.....",
        ".....######.....",
        "................",
        "....########....",
        ".####...#..#....",
        ".#.##...#..#....",
        ".#.##.####.#....",
        ".#.##...#..#....",
        ".#.##...#..#....",
        ".####...#..#....",
        "....########....",
        "...##....##.....",
        "...##....##.....",
        "...##....##.....",
        "...##....##.....",
        "...##....##.....",
        "...##....##.....",
        "...##....##.....",
        "...##...####....",
        "..####..........",
        "................"
      ]
    },
    "walk-down-right": {
      "pixels": [
        "................",
        "................",
        "......####......",
        "......#..#......",
        "......####......",
        "...##########...",
        ".....######.....",
        ".....#....#.....",
        ".....#.##.#.....",
        ".....#....#.....",
        ".....#.##.#.....",
        ".....#....#.....",
        ".....######.....",
        "................",
        "....########....",
        ".####...#..#....",
        ".#.##...#..#....",
        ".#.##.####.#....",
        ".#.##...#..#....",
        ".#.##...#..#....",
        ".####...#..#....",
        "....########....",
        ".....##....##...",
        ".....##....##...",
        ".....##....##...",
        ".....##....##...",
        ".....##....##...",
        ".....##....##...",
        ".....##....##...",
        "....####...##...",
        "..........####..",
        "................"
      ]
    }
  },
  "animations": [
    {
      "id": "idle",
      "frameMs": 400,
      "directions": {
        "down": ["idle-down"],
        "right": ["idle-right"],
        "up": ["idle-up"],
        "left": ["idle-left"]
      }
    },
    {
      "id": "walk",
      "frameMs": 140,
      "directions": {
        "down": ["idle-down", "walk-down-left", "idle-down", "walk-down-right"]
      }
    }
  ]
}
