{
  "$schema": "../../../schemas/sprite.schema.json",
  "schemaVersion": 1,
  "id": "oak-sapling",
  "name": "Oak Sapling",
  "kind": "object",
  "status": "outline",
  "description": "Grows into an oak tree.",
  "tags": ["tree"],
  "canvas": {
    "width": 16,
    "height": 16
  },
  "pivot": {
    "x": 8,
    "y": 16
  },
  "palette": {
    ".": {
      "name": "empty",
      "color": null
    },
    "a": {
      "name": "leaf-light",
      "color": "#7cc45f"
    },
    "b": {
      "name": "leaf-outline",
      "color": "#17351a"
    },
    "c": {
      "name": "leaf-base",
      "color": "#4a9a44"
    },
    "d": {
      "name": "leaf-dark",
      "color": "#2c6630"
    },
    "e": {
      "name": "darkWood-dark",
      "color": "#4a2e15"
    },
    "f": {
      "name": "darkWood-base",
      "color": "#6d4622"
    }
  },
  "frames": {
    "idle-down": {
      "pixels": [
        "................",
        "................",
        ".........aa.....",
        ".......aabcaa...",
        ".....aacbdbcd...",
        "...aabccbddbca..",
        "...cbdbccbbccca.",
        "..abdddbccccccd.",
        "..dcbbbcccccbccd",
        "...ccccccccbdbd.",
        "...ddcdcccccbcd.",
        ".....e.effefee..",
        "........fe.e....",
        "........fe......",
        "........fe......",
        "........ee......"
      ]
    }
  },
  "animations": [
    {
      "id": "idle",
      "frameMs": 400,
      "directions": {
        "down": ["idle-down"]
      }
    }
  ]
}
