{
  "$schema": "../../../schemas/sprite.schema.json",
  "schemaVersion": 1,
  "id": "pufferfish",
  "name": "Pufferfish",
  "kind": "object",
  "status": "outline",
  "description": "A round ocean fish. Handle carefully.",
  "tags": ["fish"],
  "canvas": {
    "width": 16,
    "height": 16
  },
  "pivot": {
    "x": 8,
    "y": 16
  },
  "palette": {
    ".": {
      "name": "empty",
      "color": null
    },
    "a": {
      "name": "cheese-light",
      "color": "#fbdf85"
    },
    "b": {
      "name": "cheese-dark",
      "color": "#bd8a12"
    },
    "c": {
      "name": "cheese-outline",
      "color": "#7a5406"
    },
    "d": {
      "name": "cheese-base",
      "color": "#efc23c"
    }
  },
  "frames": {
    "idle-down": {
      "pixels": [
        "................",
        "................",
        "........ab......",
        ".....ab.b..ab...",
        ".....c..da.b....",
        "...acbcacdab.ab.",
        "...b.cdcbcddab..",
        ".....dcadbcdb...",
        "..adacbddbcdddab",
        "..b.bdcaddbcb.b.",
        ".....dcbbbbcc...",
        "...adbdcccccbcb.",
        "...b..dbdbcbbc..",
        ".....ab.b..cc...",
        ".....b..db.b....",
        "........b......."
      ]
    }
  },
  "animations": [
    {
      "id": "idle",
      "frameMs": 400,
      "directions": {
        "down": ["idle-down"]
      }
    }
  ]
}
