{
  "$schema": "../../../schemas/sprite.schema.json",
  "schemaVersion": 1,
  "id": "lost-book",
  "name": "Lost Book",
  "kind": "object",
  "status": "outline",
  "description": "A recovered library book.",
  "tags": ["special"],
  "canvas": {
    "width": 16,
    "height": 16
  },
  "pivot": {
    "x": 8,
    "y": 16
  },
  "palette": {
    ".": {
      "name": "empty",
      "color": null
    },
    "a": {
      "name": "clothRed-light",
      "color": "#e57070"
    },
    "b": {
      "name": "linen-light",
      "color": "#f2ead1"
    },
    "c": {
      "name": "clothRed-base",
      "color": "#c33b3c"
    },
    "d": {
      "name": "clothRed-outline",
      "color": "#4d1517"
    },
    "e": {
      "name": "linen-base",
      "color": "#d8ccae"
    },
    "f": {
      "name": "linen-outline",
      "color": "#6a6152"
    },
    "g": {
      "name": "linen-dark",
      "color": "#a89b81"
    },
    "h": {
      "name": "clothRed-dark",
      "color": "#8d2528"
    }
  },
  "frames": {
    "idle-down": {
      "pixels": [
        "................",
        "...aaabbbbbb....",
        "...ccdeffffg....",
        "...cdhfbbbgf....",
        "...cdhfggggf....",
        "...cdhfffffg....",
        "...cdhfggggf....",
        "...cdhfffffg....",
        "...cdhfffffg....",
        "...cdhfbbbgf....",
        "...cdhfbeegf....",
        "...cdhfbeegf....",
        "...cdhfggggf....",
        "...hhdgffffg....",
        "................",
        "................"
      ]
    }
  },
  "animations": [
    {
      "id": "idle",
      "frameMs": 400,
      "directions": {
        "down": ["idle-down"]
      }
    }
  ]
}
