{
  "$schema": "../../../schemas/sprite.schema.json",
  "schemaVersion": 1,
  "id": "maren-shopkeep",
  "name": "Maren",
  "kind": "character",
  "status": "outline",
  "description": "General-store keeper in an apron. Sells seeds, food, and supplies.",
  "tags": ["villager", "human", "shopkeeper"],
  "canvas": {
    "width": 16,
    "height": 32
  },
  "pivot": {
    "x": 8,
    "y": 32
  },
  "palette": {
    ".": {
      "name": "empty",
      "color": null
    },
    "a": {
      "name": "clothRed-outline",
      "color": "#4d1517"
    },
    "b": {
      "name": "clothRed-dark",
      "color": "#8d2528"
    },
    "c": {
      "name": "clothRed-base",
      "color": "#c33b3c"
    },
    "d": {
      "name": "clothRed-light",
      "color": "#e57070"
    },
    "e": {
      "name": "skin-base",
      "color": "#e6b78d"
    },
    "f": {
      "name": "skin-outline",
      "color": "#6d422a"
    },
    "g": {
      "name": "skin-light",
      "color": "#f8d9b6"
    },
    "h": {
      "name": "skin-dark",
      "color": "#b47f52"
    },
    "i": {
      "name": "linen-light",
      "color": "#f2ead1"
    },
    "j": {
      "name": "linen-outline",
      "color": "#6a6152"
    },
    "k": {
      "name": "linen-base",
      "color": "#d8ccae"
    },
    "l": {
      "name": "linen-dark",
      "color": "#a89b81"
    },
    "m": {
      "name": "wood-outline",
      "color": "#3a2412"
    },
    "n": {
      "name": "wood-dark",
      "color": "#6b4520"
    },
    "o": {
      "name": "wood-base",
      "color": "#a06a34"
    },
    "p": {
      "name": "wood-light",
      "color": "#c89355"
    },
    "q": {
      "name": "clothBlue-base",
      "color": "#3a6fb8"
    },
    "r": {
      "name": "clothBlue-outline",
      "color": "#13294d"
    },
    "s": {
      "name": "clothBlue-dark",
      "color": "#24487f"
    },
    "t": {
      "name": "leather-dark",
      "color": "#54331c"
    },
    "u": {
      "name": "leather-base",
      "color": "#7c4e2b"
    }
  },
  "frames": {
    "idle-down": {
      "pixels": [
        "................",
        "........a.......",
        ".......aba......",
        "......abcba.....",
        ".......aba......",
        ".....ddcacd.....",
        "....deffffed....",
        "....cfghhhfb....",
        "....cfhffhfb....",
        "....cfghhhfb....",
        "....bfhffhfb....",
        ".....fhhhhf.....",
        ".....hffffh.....",
        "......eeeh......",
        "....ijkkkkji....",
        "....jljjjjlj....",
        "....jljiljlj.m..",
        "....jljiljljmnm.",
        "....jljiljljomop",
        "....jljlljljmnmn",
        "....jljjjjljnmnm",
        "....kjkllkjjnnnm",
        "....qrs..qrqmmmn",
        "....rsr..rsr....",
        "....rsr..rsr....",
        "....rsr..rsr....",
        "....rsr..rsr....",
        "....qrs..qrs....",
        "...pqqs..qqqp...",
        "...nttt..tttn...",
        "................",
        "................"
      ]
    },
    "idle-right": {
      "pixels": [
        "................",
        ".......a........",
        "......aba.......",
        ".....abcba......",
        "......aba.......",
        ".......acdddd...",
        ".......efffan...",
        ".......fgggbm...",
        ".......fgehan...",
        ".......fgeebm...",
        ".......fgeebm...",
        ".......fhhhbm...",
        ".......hfffan...",
        "........eeeb....",
        ".......ikkkkp...",
        ".......kkjjkn...",
        "......jkjiljn...",
        ".....jljjiljn...",
        "...pjkjkjlljn...",
        "...mljljkjjjn...",
        "...miljkjlllm...",
        "...mllljkjjjn...",
        "...nrrrssqs.....",
        ".........qs.....",
        ".........qs.....",
        ".........qs.....",
        ".........qs.....",
        ".........qs.....",
        ".........qs.....",
        "........uttt....",
        "................",
        "................"
      ]
    },
    "idle-left": {
      "pixels": [
        "................",
        "........a.......",
        ".......aba......",
        "......abcba.....",
        ".......aba......",
        "...ddddca.......",
        "...oafffh.......",
        "...mbgghf.......",
        "...oagehf.......",
        "...mdeehf.......",
        "...mdeehf.......",
        "...mbhhhf.......",
        "...nafffh.......",
        "....ceeh........",
        "...pkkkki.......",
        "...okjjkl.......",
        "...ojiljkj......",
        "...ojiljjlj.....",
        "...ojlljkjkjp...",
        "...ojjjkjljlm...",
        "...mllljkjilm...",
        "...njjjkjlllm...",
        ".....qqssrrrn...",
        ".....qs.........",
        ".....qs.........",
        ".....qs.........",
        ".....qs.........",
        ".....qs.........",
        ".....qs.........",
        "....uttt........",
        "................",
        "................"
      ]
    },
    "idle-up": {
      "pixels": [
        "................",
        "........a.......",
        ".......aba......",
        "......abcba.....",
        ".......aba......",
        ".....ddcacd.....",
        ".....caaaab.....",
        ".....adddba.....",
        ".....adcbba.....",
        ".....adbaba.....",
        ".....ababab.....",
        ".....bacacb.....",
        "......cccb......",
        "......cccb......",
        "....ijkkkkji....",
        "....jljjjjlj....",
        "....jljiljlj....",
        "....jljiljlj....",
        "....jljiljljmmmp",
        "....jljlljljppnm",
        "....jljjjjljponm",
        "....kjkllkjjnnnm",
        "....qrs..qrqmmmn",
        "....rsr..rsr....",
        "....rsr..rsr....",
        "....rsr..rsr....",
        "....rsr..rsr....",
        "....qrs..qrs....",
        "...pqqs..qqqp...",
        "...nttt..tttn...",
        "................",
        "................"
      ]
    },
    "walk-down-left": {
      "pixels": [
        "................",
        "........a.......",
        ".......aba......",
        "......abcba.....",
        ".......aba......",
        ".....ddcacd.....",
        "....deffffed....",
        "....cfghhhfb....",
        "....cfhffhfb....",
        "....cfghhhfb....",
        "....bfhffhfb....",
        ".....fhhhhf.....",
        ".....hffffh.....",
        "......eeeh......",
        "....ijkkkkji....",
        "....jljjjjlj....",
        "....jljiljlj.m..",
        "....jljiljljmnm.",
        "....jljiljljomop",
        "....jljlljljmnmn",
        "....jljjjjlj.m.n",
        "....kjlllkjl...n",
        "...ps....qs.....",
        "...os....qs.....",
        "...os....qs.....",
        "...os....qs.....",
        "...os....qs.....",
        "...os....qs.....",
        "...os....qs.....",
        "...ot...uttt....",
        "..ontt..........",
        "................"
      ]
    },
    "walk-down-right": {
      "pixels": [
        "................",
        "........a.......",
        ".......aba......",
        "......abcba.....",
        ".......aba......",
        ".....ddcacd.....",
        "....deffffed....",
        "....cfghhhfb....",
        "....cfhffhfb....",
        "....cfghhhfb....",
        "....bfhffhfb....",
        ".....fhhhhf.....",
        ".....hffffh.....",
        "......eeeh......",
        "....ijkkkkji....",
        "....jljjjjlj....",
        "....jljiljlj.m..",
        "....jljiljljmnm.",
        "....jljiljljomop",
        "....jljlljljmnmn",
        "....jljjjjlj.m.n",
        "....ljkllljl...n",
        ".....qs....qp...",
        ".....qs....qn...",
        ".....qs....qn...",
        ".....qs....qn...",
        ".....qs....qn...",
        ".....qs....qn...",
        ".....qs....qn...",
        "....uttt...un...",
        "..........utnn..",
        "................"
      ]
    }
  },
  "animations": [
    {
      "id": "idle",
      "frameMs": 400,
      "directions": {
        "down": ["idle-down"],
        "right": ["idle-right"],
        "up": ["idle-up"],
        "left": ["idle-left"]
      }
    },
    {
      "id": "walk",
      "frameMs": 140,
      "directions": {
        "down": ["idle-down", "walk-down-left", "idle-down", "walk-down-right"]
      }
    }
  ]
}
