{
  "$schema": "../../../schemas/sprite.schema.json",
  "schemaVersion": 1,
  "id": "rex-miner",
  "name": "Rex",
  "kind": "character",
  "status": "outline",
  "description": "Adventurer-miner with a hard hat. Hangs around the guild and the mines.",
  "tags": ["villager", "human", "miner"],
  "canvas": {
    "width": 16,
    "height": 32
  },
  "pivot": {
    "x": 8,
    "y": 32
  },
  "palette": {
    ".": {
      "name": "empty",
      "color": null
    },
    "a": {
      "name": "hair-light",
      "color": "#a06b3f"
    },
    "b": {
      "name": "hair-outline",
      "color": "#2a1a10"
    },
    "c": {
      "name": "hair-dark",
      "color": "#4d2f1a"
    },
    "d": {
      "name": "hair-base",
      "color": "#77492a"
    },
    "e": {
      "name": "iron-base",
      "color": "#8b95a4"
    },
    "f": {
      "name": "skin-outline",
      "color": "#6d422a"
    },
    "g": {
      "name": "iron-dark",
      "color": "#525b68"
    },
    "h": {
      "name": "skin-light",
      "color": "#f8d9b6"
    },
    "i": {
      "name": "skin-dark",
      "color": "#b47f52"
    },
    "j": {
      "name": "skin-base",
      "color": "#e6b78d"
    },
    "k": {
      "name": "iron-light",
      "color": "#c2cad6"
    },
    "l": {
      "name": "iron-outline",
      "color": "#23262d"
    },
    "m": {
      "name": "cheese-outline",
      "color": "#7a5406"
    },
    "n": {
      "name": "cheese-base",
      "color": "#efc23c"
    },
    "o": {
      "name": "cheese-light",
      "color": "#fbdf85"
    },
    "p": {
      "name": "cheese-dark",
      "color": "#bd8a12"
    },
    "q": {
      "name": "leather-base",
      "color": "#7c4e2b"
    },
    "r": {
      "name": "leather-outline",
      "color": "#2e1b0f"
    },
    "s": {
      "name": "leather-dark",
      "color": "#54331c"
    },
    "t": {
      "name": "leather-light",
      "color": "#a3703f"
    }
  },
  "frames": {
    "idle-down": {
      "pixels": [
        "................",
        "................",
        "....abbbbbba....",
        "....bccccccb....",
        "....dbbbbbbc....",
        "...adddddddda...",
        "...edffffffdg...",
        "...ebhihhiibg...",
        "...ebifhifibg...",
        "...ebhhiihibg...",
        "...gbhiffiibg...",
        "....biiiiffc....",
        "....cffffjfbkk..",
        "......jjjficlgg.",
        "...kmmmmnmmmg..g",
        "...looopmopmg...",
        "...lonnpmpmpl...",
        "...lonnpmpmpl...",
        "...lonnpmmopl...",
        "...lonnpmonpl...",
        "...lppppmpppl...",
        "...gmmmmpmmmg...",
        "....qrqs.qrs....",
        "....rsr..rsr....",
        "....qrs..rsr....",
        "....qrs..rsr....",
        "....rsr..rsr....",
        "...kqrs..qrs....",
        "...eqqs..qqqk...",
        "..egsss..sssg...",
        "................",
        "................"
      ]
    },
    "idle-right": {
      "pixels": [
        "................",
        "................",
        ".......abbbba...",
        ".......bccccb...",
        ".......dbbbbc...",
        ".....dddddddddc.",
        ".......jfffbg...",
        ".......fhhhcl...",
        ".......fhjibg...",
        ".......fhjjcl...",
        ".......fiijcl...",
        ".......jfficl...",
        "......ffjjfbg...",
        "....dfiifjjc....",
        "..eg..mmmmmmk...",
        "......moooopl...",
        "......monnnpl...",
        ".....omonnnpl...",
        ".....nmonnnpl...",
        ".....nmonnnpl...",
        ".....nmpppppl...",
        ".....ppmmmmmg...",
        "....t....qs.....",
        "....s....qs.....",
        "....s....qs.....",
        "....s....qs.....",
        "....s....qs.....",
        "...k.....qs.....",
        "...g.....qs.....",
        "...g....qsss....",
        "................",
        "................"
      ]
    },
    "idle-left": {
      "pixels": [
        "................",
        "................",
        "...abbbba.......",
        "...bccccb.......",
        "...dbbbbc.......",
        ".dddddddddc.....",
        "...ebfffi.......",
        "...lchhif.......",
        "...ebhjif.......",
        "...lajjif.......",
        "...lajiif.......",
        "...lciffi.......",
        "...gbfjjff......",
        "....djjfiifc....",
        "...kmmmmmm..eg..",
        "...loooopm......",
        "...lonnnpm......",
        "...lonnnpmo.....",
        "...lonnnpmp.....",
        "...lonnnpmp.....",
        "...lpppppmp.....",
        "...gmmmmmpp.....",
        ".....qs....t....",
        ".....qs....s....",
        ".....qs....s....",
        ".....qs....s....",
        ".....qs....s....",
        ".....qs.....k...",
        ".....qs.....g...",
        "....qsss....g...",
        "................",
        "................"
      ]
    },
    "idle-up": {
      "pixels": [
        "................",
        "................",
        "....abbbbbba....",
        "....bccccccb....",
        "....dbbbbbbc....",
        "...dcddddddcc...",
        ".....dbbbbc.....",
        ".....baaacb.....",
        ".....baddcb.....",
        ".....baddcb.....",
        ".....bccccb.....",
        ".....cbbbbb.....",
        "......dddbcbkk..",
        "......dddbcclgg.",
        "...kmmmmnmmmg..g",
        "...looopmopmg...",
        "...lonnpmpmpl...",
        "...lonnpmpmpl...",
        "...lonnpmmopl...",
        "...lonnpmonpl...",
        "...lppppmpppl...",
        "...gmmmmpmmmg...",
        "....qrqs.qrs....",
        "....rsr..rsr....",
        "....qrs..rsr....",
        "....qrs..rsr....",
        "....rsr..rsr....",
        "...kqrs..qrs....",
        "...eqqs..qqqk...",
        "..egsss..sssg...",
        "................",
        "................"
      ]
    },
    "walk-down-left": {
      "pixels": [
        "................",
        "................",
        "....abbbbbba....",
        "....bccccccb....",
        "....dbbbbbbc....",
        "...adddddddda...",
        "...edffffffdg...",
        "...ebhihhiibg...",
        "...ebifhifibg...",
        "...ebhhiihibg...",
        "...gbhiffiibg...",
        "....biiiiffc....",
        "....cffffjfbkk..",
        "......jjjficlgg.",
        "...kmmmmnmmmg..g",
        "...looopmopmg...",
        "...lonnpmpmpl...",
        "...lonnpmpmpl...",
        "...lonnpmmopl...",
        "...lonnpmonpl...",
        "...lppppmpppl...",
        "...emmmmpmmmg...",
        "...es....qs.....",
        "...es....qs.....",
        "...es....qs.....",
        "...es....qs.....",
        "...es....qs.....",
        "...es....qs.....",
        "...es....qs.....",
        "...es...qsss....",
        "..egss..........",
        "................"
      ]
    },
    "walk-down-right": {
      "pixels": [
        "................",
        "................",
        "....abbbbbba....",
        "....bccccccb....",
        "....dbbbbbbc....",
        "...adddddddda...",
        "...edffffffdg...",
        "...ebhihhiibg...",
        "...ebifhifibg...",
        "...ebhhiihibg...",
        "...gbhiffiibg...",
        "....biiiiffc....",
        "....cffffjfbkk..",
        "......jjjficlgg.",
        "...kmmmmnmmmg..g",
        "...looopmopmg...",
        "...lonnpmpmpl...",
        "...lonnpmpmpl...",
        "...lonnpmmopl...",
        "...lonnpmonpl...",
        "...lppppmpppl...",
        "...gmmmmpmmmg...",
        ".....qs....qg...",
        ".....qs....qg...",
        ".....qs....qg...",
        ".....qs....qg...",
        ".....qs....qg...",
        ".....qs....qg...",
        ".....qs....qg...",
        "....qsss...qg...",
        "..........qsgg..",
        "................"
      ]
    }
  },
  "animations": [
    {
      "id": "idle",
      "frameMs": 400,
      "directions": {
        "down": ["idle-down"],
        "right": ["idle-right"],
        "up": ["idle-up"],
        "left": ["idle-left"]
      }
    },
    {
      "id": "walk",
      "frameMs": 140,
      "directions": {
        "down": ["idle-down", "walk-down-left", "idle-down", "walk-down-right"]
      }
    }
  ]
}
